<?xml version="1.0" encoding="UTF-8"?>
<dataroot xmlns:od="urn:schemas-microsoft-com:officedata" xmlns:xsi="http://www.w3.org/2001/XMLSchema-instance"  xsi:noNamespaceSchemaLocation="tblAnlieferer.xsd" generated="2026-07-15T21:22:00">
<tblAnlieferer>
<AnliefererHerkunft>AWS</AnliefererHerkunft>
</tblAnlieferer>
<tblAnlieferer>
<AnliefererHerkunft>AWV</AnliefererHerkunft>
</tblAnlieferer>
<tblAnlieferer>
<AnliefererHerkunft>Bensheim</AnliefererHerkunft>
</tblAnlieferer>
<tblAnlieferer>
<AnliefererHerkunft>Biblis</AnliefererHerkunft>
</tblAnlieferer>
<tblAnlieferer>
<AnliefererHerkunft>Biebesheim</AnliefererHerkunft>
</tblAnlieferer>
<tblAnlieferer>
<AnliefererHerkunft>Bobstadt</AnliefererHerkunft>
</tblAnlieferer>
<tblAnlieferer>
<AnliefererHerkunft>Braunshardt</AnliefererHerkunft>
</tblAnlieferer>
<tblAnlieferer>
<AnliefererHerkunft>Bürger</AnliefererHerkunft>
</tblAnlieferer>
<tblAnlieferer>
<AnliefererHerkunft>Bürstadt</AnliefererHerkunft>
</tblAnlieferer>
<tblAnlieferer>
<AnliefererHerkunft>Büttelborn</AnliefererHerkunft>
</tblAnlieferer>
<tblAnlieferer>
<AnliefererHerkunft>Dornheim</AnliefererHerkunft>
</tblAnlieferer>
<tblAnlieferer>
<AnliefererHerkunft>Fürth</AnliefererHerkunft>
</tblAnlieferer>
<tblAnlieferer>
<AnliefererHerkunft>Gemeinde</AnliefererHerkunft>
</tblAnlieferer>
<tblAnlieferer>
<AnliefererHerkunft>Gernsheim</AnliefererHerkunft>
</tblAnlieferer>
<tblAnlieferer>
<AnliefererHerkunft>Grasellenbach</AnliefererHerkunft>
</tblAnlieferer>
<tblAnlieferer>
<AnliefererHerkunft>Griesheim</AnliefererHerkunft>
</tblAnlieferer>
<tblAnlieferer>
<AnliefererHerkunft>Groß-Rohrheim</AnliefererHerkunft>
</tblAnlieferer>
<tblAnlieferer>
<AnliefererHerkunft>Heppenheim</AnliefererHerkunft>
</tblAnlieferer>
<tblAnlieferer>
<AnliefererHerkunft>Kunde</AnliefererHerkunft>
</tblAnlieferer>
<tblAnlieferer>
<AnliefererHerkunft>Lampertheim</AnliefererHerkunft>
</tblAnlieferer>
<tblAnlieferer>
<AnliefererHerkunft>Lautertal (Odenwald)</AnliefererHerkunft>
</tblAnlieferer>
<tblAnlieferer>
<AnliefererHerkunft>Lindenfels</AnliefererHerkunft>
</tblAnlieferer>
<tblAnlieferer>
<AnliefererHerkunft>Mörlenbach</AnliefererHerkunft>
</tblAnlieferer>
<tblAnlieferer>
<AnliefererHerkunft>Nauheim</AnliefererHerkunft>
</tblAnlieferer>
<tblAnlieferer>
<AnliefererHerkunft>Nordheim</AnliefererHerkunft>
</tblAnlieferer>
<tblAnlieferer>
<AnliefererHerkunft>Riedstadt</AnliefererHerkunft>
</tblAnlieferer>
<tblAnlieferer>
<AnliefererHerkunft>Riedstadt Friedhof</AnliefererHerkunft>
</tblAnlieferer>
<tblAnlieferer>
<AnliefererHerkunft>Rimbach</AnliefererHerkunft>
</tblAnlieferer>
<tblAnlieferer>
<AnliefererHerkunft>Rüsselsheim</AnliefererHerkunft>
</tblAnlieferer>
<tblAnlieferer>
<AnliefererHerkunft>Stadt</AnliefererHerkunft>
</tblAnlieferer>
<tblAnlieferer>
<AnliefererHerkunft>Stockstadt</AnliefererHerkunft>
</tblAnlieferer>
<tblAnlieferer>
<AnliefererHerkunft>Stockstadt Friedhof</AnliefererHerkunft>
</tblAnlieferer>
<tblAnlieferer>
<AnliefererHerkunft>SUED</AnliefererHerkunft>
</tblAnlieferer>
<tblAnlieferer>
<AnliefererHerkunft>Trebur</AnliefererHerkunft>
</tblAnlieferer>
<tblAnlieferer>
<AnliefererHerkunft>Wallerstädten</AnliefererHerkunft>
</tblAnlieferer>
<tblAnlieferer>
<AnliefererHerkunft>Weiterstadt</AnliefererHerkunft>
</tblAnlieferer>
</dataroot>
